# 이 파일은 예제를 실제로 돌린 기록이다.
# 원격 Tibero 에 SSH 로 붙어 돌렸다 (§6). 접속 정보는 저장소에 두지 않는다.
#
# 명령      : tbsql <계정>/<비밀번호> @merge_examples.sql   (SET ECHO ON 으로 문장과 결과를 함께)
# 수행 시각 : 2026-09-22 10:34 (대한민국 표준시)
# 환경      : Tibero 7.2 / Linux x86_64
# 종료 코드 : 0  (스크립트 마지막의 남은 객체 수가 0 이면 정리까지 끝난 것이다)
#
# 출력에서 호스트명·경로·IP·내부 빌드 번호를 지웠다. 에러는 제약을 보여주려고
# 일부러 일으킨 것이며 code/README.md 에 목록이 있다.

tbSQL 7

TmaxTibero Corporation Copyright (c) 2020-. All rights reserved.

Connected to Tibero.

SQL> SET LINESIZE 140
SQL> SET PAGESIZE 200
SQL> SET FEEDBACK ON
SQL>
SQL> PROMPT ===== 0. 예제 객체 생성 =====
===== 0. 예제 객체 생성 =====
SQL>
SQL> CREATE TABLE product_master (
   2   product_id   NUMBER       PRIMARY KEY,
   3   product_name VARCHAR2(40) NOT NULL,
   4   price        NUMBER       NOT NULL,
   5   stock_qty    NUMBER       NOT NULL
   6 );

Table 'PRODUCT_MASTER' created.

SQL>
SQL> CREATE TABLE product_feed (
   2   product_id   NUMBER,
   3   product_name VARCHAR2(40),
   4   price        NUMBER,
   5   stock_qty    NUMBER
   6 );

Table 'PRODUCT_FEED' created.

SQL>
SQL> INSERT INTO product_feed VALUES (1, '기계식 키보드', 95000, 0);

1 row inserted.

SQL> INSERT INTO product_feed VALUES (2, '무선 마우스', 32000, 7);

1 row inserted.

SQL> INSERT INTO product_feed VALUES (3, '모니터 암', 49000, 30);

1 row inserted.

SQL> INSERT INTO product_feed VALUES (5, 'USB-C 케이블', 9000, 100);

1 row inserted.

SQL> COMMIT;

Commit completed.

SQL>
SQL> PROMPT ===== 1. 기본 UPSERT =====
===== 1. 기본 UPSERT =====
SQL> PROMPT -- 초기 상태로 되돌린다
-- 초기 상태로 되돌린다
SQL>
SQL> DELETE FROM product_master;

0 row deleted.

SQL> INSERT INTO product_master VALUES (1, '기계식 키보드', 89000, 12);

1 row inserted.

SQL> INSERT INTO product_master VALUES (2, '무선 마우스', 32000, 7);

1 row inserted.

SQL> INSERT INTO product_master VALUES (3, '모니터 암', 54000, 0);

1 row inserted.

SQL> INSERT INTO product_master VALUES (4, '노트북 거치대', 21000, 0);

1 row inserted.

SQL> COMMIT;

Commit completed.

SQL>
SQL> MERGE INTO product_master t
   2 USING product_feed s
   3    ON (t.product_id = s.product_id)
   4  WHEN MATCHED THEN
   5       UPDATE SET t.price = s.price, t.stock_qty = s.stock_qty
   6  WHEN NOT MATCHED THEN
   7       INSERT (product_id, product_name, price, stock_qty)
   8       VALUES (s.product_id, s.product_name, s.price, s.stock_qty);

4 rows merged.

SQL>
SQL> SELECT product_id, product_name, price, stock_qty
   2   FROM product_master
   3  ORDER BY product_id;

PRODUCT_ID PRODUCT_NAME                                  PRICE  STOCK_QTY
---------- ---------------------------------------- ---------- ----------
         1 기계식 키보드                                 95000          0
         2 무선 마우스                                   32000          7
         3 모니터 암                                     49000         30
         4 노트북 거치대                                 21000          0
         5 USB-C 케이블                                   9000        100

5 rows selected.

SQL> ROLLBACK;

Rollback completed.

SQL>
SQL> PROMPT ===== 2. WHEN MATCHED 만 쓴다 (신규는 무시) =====
===== 2. WHEN MATCHED 만 쓴다 (신규는 무시) =====
SQL>
SQL> MERGE INTO product_master t
   2 USING product_feed s
   3    ON (t.product_id = s.product_id)
   4  WHEN MATCHED THEN
   5       UPDATE SET t.price = s.price, t.stock_qty = s.stock_qty;

3 rows merged.

SQL>
SQL> SELECT product_id, product_name, price, stock_qty
   2   FROM product_master
   3  ORDER BY product_id;

PRODUCT_ID PRODUCT_NAME                                  PRICE  STOCK_QTY
---------- ---------------------------------------- ---------- ----------
         1 기계식 키보드                                 95000          0
         2 무선 마우스                                   32000          7
         3 모니터 암                                     49000         30
         4 노트북 거치대                                 21000          0

4 rows selected.

SQL> ROLLBACK;

Rollback completed.

SQL>
SQL> PROMPT ===== 3. WHEN NOT MATCHED 만 쓴다 (기존 행은 건드리지 않는다) =====
===== 3. WHEN NOT MATCHED 만 쓴다 (기존 행은 건드리지 않는다) =====
SQL>
SQL> MERGE INTO product_master t
   2 USING product_feed s
   3    ON (t.product_id = s.product_id)
   4  WHEN NOT MATCHED THEN
   5       INSERT (product_id, product_name, price, stock_qty)
   6       VALUES (s.product_id, s.product_name, s.price, s.stock_qty);

1 row merged.

SQL>
SQL> SELECT product_id, product_name, price, stock_qty
   2   FROM product_master
   3  ORDER BY product_id;

PRODUCT_ID PRODUCT_NAME                                  PRICE  STOCK_QTY
---------- ---------------------------------------- ---------- ----------
         1 기계식 키보드                                 89000         12
         2 무선 마우스                                   32000          7
         3 모니터 암                                     54000          0
         4 노트북 거치대                                 21000          0
         5 USB-C 케이블                                   9000        100

5 rows selected.

SQL> ROLLBACK;

Rollback completed.

SQL>
SQL> PROMPT ===== 4. UPDATE 에 WHERE 를 달아 값이 바뀐 행만 갱신 =====
===== 4. UPDATE 에 WHERE 를 달아 값이 바뀐 행만 갱신 =====
SQL>
SQL> MERGE INTO product_master t
   2 USING product_feed s
   3    ON (t.product_id = s.product_id)
   4  WHEN MATCHED THEN
   5       UPDATE SET t.price = s.price, t.stock_qty = s.stock_qty
   6       WHERE t.price <> s.price;

2 rows merged.

SQL>
SQL> SELECT product_id, product_name, price, stock_qty
   2   FROM product_master
   3  ORDER BY product_id;

PRODUCT_ID PRODUCT_NAME                                  PRICE  STOCK_QTY
---------- ---------------------------------------- ---------- ----------
         1 기계식 키보드                                 95000          0
         2 무선 마우스                                   32000          7
         3 모니터 암                                     49000         30
         4 노트북 거치대                                 21000          0

4 rows selected.

SQL> ROLLBACK;

Rollback completed.

SQL>
SQL> PROMPT ===== 5. DELETE WHERE - 갱신 뒤 값을 기준으로 지운다 =====
===== 5. DELETE WHERE - 갱신 뒤 값을 기준으로 지운다 =====
SQL> PROMPT -- 1번은 12 -> 0 이 되어 지워지고, 3번은 0 -> 30 이 되어 남는다
-- 1번은 12 -> 0 이 되어 지워지고, 3번은 0 -> 30 이 되어 남는다
SQL> PROMPT -- 4번은 재고가 0이지만 피드에 없어 갱신되지 않았으므로 남는다
-- 4번은 재고가 0이지만 피드에 없어 갱신되지 않았으므로 남는다
SQL>
SQL> MERGE INTO product_master t
   2 USING product_feed s
   3    ON (t.product_id = s.product_id)
   4  WHEN MATCHED THEN
   5       UPDATE SET t.price = s.price, t.stock_qty = s.stock_qty
   6       DELETE WHERE t.stock_qty = 0
   7  WHEN NOT MATCHED THEN
   8       INSERT (product_id, product_name, price, stock_qty)
   9       VALUES (s.product_id, s.product_name, s.price, s.stock_qty);

4 rows merged.

SQL>
SQL> SELECT product_id, product_name, price, stock_qty
   2   FROM product_master
   3  ORDER BY product_id;

PRODUCT_ID PRODUCT_NAME                                  PRICE  STOCK_QTY
---------- ---------------------------------------- ---------- ----------
         2 무선 마우스                                   32000          7
         3 모니터 암                                     49000         30
         4 노트북 거치대                                 21000          0
         5 USB-C 케이블                                   9000        100

4 rows selected.

SQL> ROLLBACK;

Rollback completed.

SQL>
SQL> PROMPT ===== 6. UPDATE WHERE 에 걸러진 행은 DELETE WHERE 도 건너뛴다 =====
===== 6. UPDATE WHERE 에 걸러진 행은 DELETE WHERE 도 건너뛴다 =====
SQL> PROMPT -- 피드에 4번을 같은 가격, 재고 0으로 넣는다
-- 피드에 4번을 같은 가격, 재고 0으로 넣는다
SQL> PROMPT -- UPDATE WHERE 가 4번을 거르므로 재고가 0이어도 지워지지 않는다
-- UPDATE WHERE 가 4번을 거르므로 재고가 0이어도 지워지지 않는다
SQL>
SQL> INSERT INTO product_feed VALUES (4, '노트북 거치대', 21000, 0);

1 row inserted.

SQL> COMMIT;

Commit completed.

SQL>
SQL> MERGE INTO product_master t
   2 USING product_feed s
   3    ON (t.product_id = s.product_id)
   4  WHEN MATCHED THEN
   5       UPDATE SET t.price = s.price, t.stock_qty = s.stock_qty
   6       WHERE t.price <> s.price
   7       DELETE WHERE t.stock_qty = 0;

2 rows merged.

SQL>
SQL> SELECT product_id, product_name, price, stock_qty
   2   FROM product_master
   3  ORDER BY product_id;

PRODUCT_ID PRODUCT_NAME                                  PRICE  STOCK_QTY
---------- ---------------------------------------- ---------- ----------
         2 무선 마우스                                   32000          7
         3 모니터 암                                     49000         30
         4 노트북 거치대                                 21000          0

3 rows selected.

SQL> ROLLBACK;

Rollback completed.

SQL>
SQL> PROMPT ===== 7. ON 절에 쓴 컬럼을 UPDATE 하면 어떻게 되는가 =====
===== 7. ON 절에 쓴 컬럼을 UPDATE 하면 어떻게 되는가 =====
SQL>
SQL> MERGE INTO product_master t
   2 USING product_feed s
   3    ON (t.product_id = s.product_id)
   4  WHEN MATCHED THEN
   5       UPDATE SET t.product_id = s.product_id + 100;
TBR-8101: Column used in the ON clause cannot be updated.
at line 3, column 9 of null:
   ON (t.product_id = s.product_id)
       ^

SQL>
SQL> PROMPT ===== 8. 소스에 같은 키가 두 번 있으면 어떻게 되는가 =====
===== 8. 소스에 같은 키가 두 번 있으면 어떻게 되는가 =====
SQL>
SQL> INSERT INTO product_feed VALUES (2, '무선 마우스 v2', 35000, 3);

1 row inserted.

SQL> COMMIT;

Commit completed.

SQL>
SQL> MERGE INTO product_master t
   2 USING product_feed s
   3    ON (t.product_id = s.product_id)
   4  WHEN MATCHED THEN
   5       UPDATE SET t.price = s.price, t.stock_qty = s.stock_qty;
TBR-10021: Inconsistent set of rows in source tables.

SQL>
SQL> ROLLBACK;

Rollback completed.

SQL>
SQL> PROMPT ===== 9. 소스를 서브질의로 묶어 중복을 없애면 통과한다 =====
===== 9. 소스를 서브질의로 묶어 중복을 없애면 통과한다 =====
SQL>
SQL> MERGE INTO product_master t
   2 USING (SELECT product_id,
   3               MAX(price)     AS price,
   4               MAX(stock_qty) AS stock_qty
   5          FROM product_feed
   6         GROUP BY product_id) s
   7    ON (t.product_id = s.product_id)
   8  WHEN MATCHED THEN
   9       UPDATE SET t.price = s.price, t.stock_qty = s.stock_qty;

4 rows merged.

SQL>
SQL> SELECT product_id, product_name, price, stock_qty
   2   FROM product_master
   3  ORDER BY product_id;

PRODUCT_ID PRODUCT_NAME                                  PRICE  STOCK_QTY
---------- ---------------------------------------- ---------- ----------
         1 기계식 키보드                                 95000          0
         2 무선 마우스                                   35000          7
         3 모니터 암                                     49000         30
         4 노트북 거치대                                 21000          0

4 rows selected.

SQL> ROLLBACK;

Rollback completed.

SQL>
SQL> PROMPT ===== 10. 타깃에만 있는 행을 다루는 절이 있는가 =====
===== 10. 타깃에만 있는 행을 다루는 절이 있는가 =====
SQL>
SQL> MERGE INTO product_master t
   2 USING product_feed s
   3    ON (t.product_id = s.product_id)
   4  WHEN NOT MATCHED BY SOURCE THEN
   5       DELETE;
TBR-8004: Syntax error.
at line 4, column 19 of null:
 WHEN NOT MATCHED BY SOURCE THEN
                  ^

SQL>
SQL> PROMPT ===== 11. 정리 =====
===== 11. 정리 =====
SQL>
SQL> DROP TABLE product_feed;

Table 'PRODUCT_FEED' dropped.

SQL> DROP TABLE product_master;

Table 'PRODUCT_MASTER' dropped.

SQL>
SQL> SELECT COUNT(*) AS obj_left FROM user_objects;

  OBJ_LEFT
----------
         0

1 row selected.

SQL>
SQL> EXIT
Disconnected.
